ページ番号,設問番号,設問文章,説明文,選択肢,矛盾が発生するやつ,他の選択肢と押すと矛盾する選択肢,残す選択肢,理由
20,L,以下の選択肢に、自分を表現する言葉として使っているものがあれば全て選択してください。(複数回答可),,"トランスジェンダー,ノンバイナリー,Xジェンダー,どれも使っていない",TRUE,どれも使っていない,どれも使っていない,Aro/AceってLGBTって関係ないっすよね？というコメントに対して、「いや、これだけAro/Aceコミュニティ内にはトランスがいるぞ」と言いたいので、その逆にする（保守的数字、以下同じ）
62,AQ,これまでにカミングアウトした相手は誰ですか。(複数回答可),,"パートナーおよび元パートナー,学校の友人(同級生、先輩、後輩),インターネットで知り合った友人,上記以外の友人,職場の人(上司以外),上司,母親,父親,きょうだい,他の家族、親族,教師・学校職員,カウンセラー、相談員,医療関係者",FALSE,,,
64,AR,カミングアウトをした理由として、以下の選択肢にあてはまるものがあれば全て選択してください。(複数回答可),,"伝えないことで、嘘をついてるように感じたから,セクシュアリティを隠すことにストレスを感じたから,自分のことをより深く相手に知ってもらいたかったから,自分のセクシュアリティについて、当事者ではない人も正しく知ってほしかったから,自分の生き方、ライフプランを尊重してほしかったから,恋愛／性愛感情を自分に向けてほしくなかったから,恋愛／性愛に関連する話題を自分に質問してほしくなかったから,告白を断りたかったから,性的な行為をしたくなかったから,近いセクシュアリティの人と繋がりたかったから,深い理由はなかった",TRUE,深い理由はなかった,深い理由はなかった,カミングアウトは大変なことで、当事者のしんどさをあらわすものでもあるので理由を重めに表現したい
85,BC,法律上、どのような関係の子どもを望みますか。以下の中からあてはまるものを全て選択してください。(複数回答可),選択肢にあてはまるものがない場合は「その他」にお書きください。,"実子,養子,里子",FALSE,,,
90,BF,以下のうち、嫌悪感を覚える行為はどれですか。(複数回答可),,"異性間の恋愛作品の鑑賞,男性同士の恋愛作品の鑑賞,女性同士の恋愛作品の鑑賞,他の人の恋愛話を聞く,自分の恋愛話を聞かれる,どれにも嫌悪感を覚えない",TRUE,どれにも嫌悪感を覚えない,他の選択肢,Aro/Aceと嫌悪感は別物であると表現したい
90,BG,以下のうち、嫌悪感を覚える行為はどれですか。(複数回答可),,"異性間の性的作品の鑑賞,男性同士の性的作品の鑑賞,女性同士の性的作品の鑑賞,他の人の性的な話を聞く,自分の性的な話を聞かれる,どれにも嫌悪感を覚えない",TRUE,どれにも嫌悪感を覚えない,他の選択肢,Aro/Aceと嫌悪感は別物であると表現したい
90,BH,以下のうち、「誰からであっても(自分が相手に惹かれていても)」嫌悪感を覚える行為はどれですか。(複数回答可),,"恋愛感情を向けられる,交際を申し込まれる,自身に対する恋愛感情があることを告げられる,性的な目で見られる,性的な誘いを受ける,どれにも嫌悪感を覚えない",TRUE,どれにも嫌悪感を覚えない,他の選択肢,Aro/Aceと嫌悪感は別物であると表現したい
90,BI,以下のうち、「誰からであっても(自分が相手に惹かれていても)」嫌悪感を覚える行為はどれですか。(複数回答可),,"握手する,手をつなぐ,ハグをする,キスをする,どれにも嫌悪感を覚えない",TRUE,どれにも嫌悪感を覚えない,他の選択肢,Aro/Aceと嫌悪感は別物であると表現したい
95,BJ,以下の選択肢から、恋愛／性愛感情が含まれない“愛情”を感じる対象があれば、あてはまるものを全て選択してください。(複数回答可),選択肢にない対象がいれば「その他」にお書きください。,"家族,友人,パートナー,“推し”、応援している人・キャラクターなど,職場関係の人,ペット・動物,愛情を感じる対象はいない",TRUE,愛情を感じる対象はいない,愛情を感じる対象はいない,Aro/Aceにも愛情があると表現したい（冷たい、愛情がないという偏見に対抗したい）
99,BL,Aro/Aceに関する相談に期待する／していたのはどのようなことですか。あてはまるものを全て選択してください。(複数回答可),,"とくになかった,自分のセクシュアリティが何にあてはまるか聞きたかった,自分のあり方を肯定してほしかった,他のAro/Aceと繋がる方法を知りたかった,Aro/Aceに関する情報を知りたかった,パートナーとの関係を相談したかった,家族との関係を相談したかった,一人で生きていく方法を知りたかった,パートナーを作る方法を知りたかった,Aro/Aceとして生きる将来像、ライフプランを相談したかった,健康上の問題があるか相談したかった",TRUE,とくになかった,とくになかった,Aro/Ace相談にはたくさん期待やニーズがあるのにもかかわらず、問題がたくさんあると言いたい
103,BN,Aro/Aceについて相談をした窓口やカウンセラー、医療機関等は以下のどれにあてはまりますか。(複数回答可),,"心理カウンセラー,LGBTQ専門相談,精神科・心療内科,産婦人科・泌尿器科,キャリア相談,いのちの電話,よりそいホットライン,女性相談・男性相談,スクールカウンセラーや学生相談室,自治体などのよろず相談,法律相談",FALSE,,,
108,BQ,相談をした際に、以下のことを経験したことはありますか。あてはまるものを全て選択してください。(複数回答可),,"とくになかった,相談した相手がAro/Aceについて十分に知識を持っていなかった,将来、結婚する／子どもを育てる前提で話された,“恋愛”をすると良いと助言された,性行為を(いつか)する前提で話された,自分の悩みの原因が、生育歴や家族との関係性にあると決めつけられた,健康上の問題があると決めつけられた,説明ばかり求められ、本題の相談ができなかった",TRUE,とくになかった,とくになかった,Aro/Ace相談には課題があると言いたい
110,BR,Aro/Aceについて相談をしなかった理由として、あてはまるものがあれば全て選択してください。(複数回答可),,"Aro/Aceに関連した困りごとや悩みがなかった,どこに相談をしていいかわからなかった,相談しても解決してもらえないと感じた,相談できる場所があると思わなかった,Aro/Aceであることを第三者に知られてしまうかもしれないと思った,うまく説明や相談ができるかわからなかった,相談したら自身がAro/Aceであると確定してしまう気がしたから,相談しなくても解決できると思った,相談したら無理解な言動をされるかもしれないと思った,相談しても困りごととして受け止めてもらえないと思った",FALSE,,,
114,BT,Aro/Ace以外のことについて、相談をした窓口やカウンセラー、医療機関等は以下のどれにあてはまりますか。(複数回答可),,"心理カウンセラー,LGBTQ専門相談,精神科・心療内科,産婦人科・泌尿器科,キャリア相談,いのちの電話,よりそいホットライン,女性相談・男性相談,スクールカウンセラーや学生相談室,自治体などのよろず相談,法律相談",FALSE,,,
116,BV,相談をした際に、以下のことを経験したことはありますか。あてはまるものを全て選択してください。(複数回答可),,"とくになかった,セクシュアリティを知られないよう、言えないことがあった／嘘をつかないといけなかった,将来、結婚する／子どもを育てる前提で話された,“恋愛”をすると良いと助言された,性行為を(いつか)する前提で話された,自分の悩みの原因が、生育歴や家族との関係性にあると決めつけられた,自分の悩みの原因が、恋愛／性愛に関連していると決めつけられた,恋愛/性愛に興味がない(薄い)ことで、健康上の問題があると決めつけられた,(話の流れで)カミングアウトしたところ、説明ばかり求められ、本題の相談ができなかった",TRUE,とくになかった,とくになかった,Aro/Ace相談には課題があると言いたい
119,BW,Aro/Aceであることで以下のことを経験したことはありますか。あてはまるものを全て選択してください。(複数回答可),理由がはっきりしない場合でも、あなたがAro/Aceと関連があると感じていれば選択してください。,"とくになかった,直接、不愉快な言葉を言われた,直接、不愉快な言葉を見聞きした,オンライン上で不愉快な言葉を言われた,オンライン上で不愉快な言葉を見聞きした,不愉快な個人的な質問をされた,友人との関係において困難があった,家族、親族との関係において困難があった,恋人／パートナーとの関係において困難があった,恋人／パートナー探しにおいて困難があった,「治療」を勧められた,身体的な暴力を受けた,精神状態が悪化した,学校生活を送る中で困難があった,就職活動や仕事をする中で困難があった,部屋探しや賃貸契約での困難があった,心理的なサポートを受ける際の困難があった,その他医療を受ける際の困難があった,その他",TRUE,とくになかった,とくになかった,Aro/Aceには困難経験があって、社会課題があることを表現したい
122,BY,Aro/Aceとして生きる中で不安を感じることはどのようなものがありますか。以下からあてはまるものを全て選択してください。(複数回答可),,"とくにない,周囲に自分のあり方が理解されないこと,友人との関係がうまくいかないこと,家族、親族との関係がうまくいかないこと,恋人／パートナーとの関係がうまくいかないこと,恋人／パートナー探しがうまくいかないこと,恋人／パートナーを持たない生き方をすること,病気やケガをしたときに助けてくれる人がいないこと,学校生活がうまくいかないこと,就職活動や仕事がうまくいかないこと,部屋探しや賃貸契約がうまくいかないこと,心理的なサポートを受ける際に自分のあり方が理解されないこと,医療、介護を受ける際に自分のあり方が理解されないこと",TRUE,とくにない,とくにない,Aro/Aceには不安に思っていて、社会課題があることを表現したい
132,CD,性行為をする(していた)理由はなんですか。以下から近いものを全て選択してください。(複数回答可),,"愛情を表現するため,ふれあい(コミュニケーション)のため,子どもが欲しいため,相手に求められるため,性欲の発散のため,性的な快感のため,自分の性的指向／性的欲求を探求するため,好奇心から,ストレスを解消するため,他の人から勧められるため,他の人とそれについて話せるため,眠りを助けるため,習慣だから,生理周期と関連してしたくなるため,夢精をしないようにするため,経済的な利益があるため",FALSE,,,
136,CF,自慰行為をする(していた)理由はなんですか。以下から近いものを全て選択してください。(複数回答可),,"自分のパートナーと性交渉を持てない時に、性的な快感を得るため,性欲の発散のため,性的な快感のため,自分の性的指向／性的欲求を探求するため,ストレスを解消するため,好奇心から,他の人から勧められるため,他の人とそれについて話せるため,眠りを助けるため,習慣だから,生理周期と関連してしたくなるため,夢精をしないようにするため,経済的な利益があるため",FALSE,,,
138,CH,【必須項目】これまでに本調査に回答したことがありますか。(複数回答可),,"今回初めて回答した,2020年の調査に回答した,2022年の調査に回答した",TRUE,今回初めて回答した,他の選択肢,これに関してはどちらでもよいが、わりと新規でも回答傾向が変わらないから「この調査がちゃんとしている、コミュニティがちゃんとしている感」を表現したい、ということにする。